{
  "$schema": "http://json-schema.org/draft-06/schema#",
  "$ref": "#/definitions/Group",
  "definitions": {
    "Group": {
      "type": "object",
      "additionalProperties": false,
      "properties": {
        "schemas": {
          "type": "array",
          "items": {
            "type": "string"
          }
        },
        "id": {
          "type": "string"
        },
        "displayName": {
          "type": "string"
        },
        "members": {
          "type": "array",
          "items": {
            "$ref": "#/definitions/Member"
          }
        },
        "meta": {
          "$ref": "#/definitions/Meta"
        }
      },
      "required": [
        "displayName",
        "id",
        "members",
        "meta",
        "schemas"
      ],
      "title": "Group"
    },
    "Member": {
      "type": "object",
      "additionalProperties": false,
      "properties": {
        "value": {
          "type": "string"
        },
        "display": {
          "type": "string"
        }
      },
      "required": [
        "display",
        "value"
      ],
      "title": "Member"
    },
    "Meta": {
      "type": "object",
      "additionalProperties": false,
      "properties": {
        "created": {
          "type": "string"
        },
        "location": {
          "type": "string",
          "format": "uri",
          "qt-uri-protocols": [
            "https"
          ]
        }
      },
      "required": [
        "created",
        "location"
      ],
      "title": "Meta"
    }
  }
}
